{
  "$schema": "https://json-schema.org/draft/2020-12/schema",
  "$id": "https://datageek.dev/schemas/delivery-graph.schema.json",
  "title": "Delivery Graph Engineering Graph",
  "type": "object",
  "required": ["graph", "demands", "requirements", "tracks", "nodes"],
  "additionalProperties": false,
  "properties": {
    "graph": {
      "type": "object",
      "required": ["id", "title", "status"],
      "additionalProperties": false,
      "properties": {
        "id": { "type": "string", "pattern": "^DGE-[0-9]{3,}$" },
        "title": { "type": "string", "minLength": 1 },
        "status": {
          "type": "string",
          "enum": ["draft", "active", "blocked", "review", "done"]
        },
        "source": { "type": "string" },
        "created_at": { "type": "string" },
        "updated_at": { "type": "string" },
        "rev": { "type": "integer", "minimum": 0 },
        "settings": {
          "type": "object",
          "description": "Graph-wide policy toggles. Opt-in so existing graphs keep their behavior.",
          "properties": {
            "require_seal": {
              "type": "boolean",
              "description": "DEM-020: when true, verifyNode requires an intact HMAC seal on a node's validation contract before considering evidence. Default off.",
              "default": false
            }
          }
        }
      }
    },
    "demands": {
      "type": "array",
      "items": { "$ref": "#/$defs/demand" }
    },
    "requirements": {
      "type": "array",
      "items": { "$ref": "#/$defs/requirement" }
    },
    "gaps": {
      "type": "array",
      "items": { "$ref": "#/$defs/gap" },
      "default": []
    },
    "tracks": {
      "type": "array",
      "items": { "$ref": "#/$defs/track" }
    },
    "nodes": {
      "type": "array",
      "items": { "$ref": "#/$defs/node" }
    }
  },
  "$defs": {
    "demand": {
      "type": "object",
      "required": ["id", "title", "source", "outcome"],
      "additionalProperties": false,
      "properties": {
        "id": { "type": "string", "pattern": "^DEM-[0-9]{3,}$" },
        "title": { "type": "string", "minLength": 1 },
        "source": { "type": "string", "minLength": 1 },
        "requester": { "type": "string" },
        "summary": { "type": "string" },
        "problem": { "type": "string" },
        "outcome": { "type": "string", "minLength": 1 },
        "constraints": {
          "type": "array",
          "items": { "type": "string" },
          "default": []
        },
        "non_goals": {
          "type": "array",
          "items": { "type": "string" },
          "default": []
        }
      }
    },
    "requirement": {
      "type": "object",
      "required": ["id", "demand_id", "statement", "acceptance", "validation"],
      "additionalProperties": false,
      "properties": {
        "id": { "type": "string", "pattern": "^REQ-[0-9]{3,}$" },
        "demand_id": { "type": "string", "pattern": "^DEM-[0-9]{3,}$" },
        "statement": { "type": "string", "minLength": 1 },
        "priority": {
          "type": "string",
          "enum": ["must", "should", "could", "wont"],
          "default": "must"
        },
        "acceptance": {
          "type": "array",
          "minItems": 1,
          "items": { "type": "string" }
        },
        "validation": {
          "type": "object",
          "required": ["method", "required_evidence"],
          "additionalProperties": false,
          "properties": {
            "method": {
              "type": "string",
              "enum": ["automated-test", "eval", "manual-review", "ci-check", "artifact-review"]
            },
            "required_evidence": {
              "type": "array",
              "minItems": 1,
              "items": { "type": "string" }
            }
          }
        }
      }
    },
    "gap": {
      "type": "object",
      "required": ["id", "type", "severity", "question", "blocks"],
      "additionalProperties": false,
      "properties": {
        "id": { "type": "string", "pattern": "^GAP-[0-9]{3,}$" },
        "type": {
          "type": "string",
          "enum": ["problem", "success", "scope", "stakeholder", "validation", "constraint", "dependency", "contradiction", "privacy", "architecture", "ownership"]
        },
        "severity": {
          "type": "string",
          "enum": ["blocker", "major", "warning", "note"]
        },
        "question": { "type": "string", "minLength": 1 },
        "blocks": {
          "type": "array",
          "items": { "type": "string" }
        },
        "resolution": {
          "type": ["string", "null"],
          "default": null
        }
      }
    },
    "track": {
      "type": "object",
      "required": ["id", "title"],
      "additionalProperties": false,
      "properties": {
        "id": { "type": "string", "pattern": "^TRK-[a-z0-9-]+$" },
        "title": { "type": "string", "minLength": 1 },
        "description": { "type": "string" },
        "owner": { "type": "string" }
      }
    },
    "node": {
      "type": "object",
      "required": ["id", "title", "type", "track", "requirement_ids", "depends_on", "status", "validation", "sync"],
      "additionalProperties": false,
      "properties": {
        "id": { "type": "string", "pattern": "^NODE-[0-9]{3,}$" },
        "title": { "type": "string", "minLength": 1 },
        "type": {
          "type": "string",
          "enum": ["research", "implementation", "test", "eval", "docs", "release", "review"]
        },
        "track": { "type": "string", "pattern": "^TRK-[a-z0-9-]+$" },
        "requirement_ids": {
          "type": "array",
          "minItems": 1,
          "items": { "type": "string", "pattern": "^REQ-[0-9]{3,}$" }
        },
        "depends_on": {
          "type": "array",
          "items": { "type": "string", "pattern": "^NODE-[0-9]{3,}$" }
        },
        "status": {
          "type": "string",
          "enum": ["proposed", "ready", "in_progress", "blocked", "review", "verified", "done", "done-waived"]
        },
        "validation": {
          "type": "object",
          "required": ["required", "evidence_path"],
          "additionalProperties": false,
          "properties": {
            "required": {
              "type": "array",
              "minItems": 1,
              "items": { "type": "string" }
            },
            "evidence_path": {
              "type": "string",
              "pattern": "^delivery-graph/demands/DEM-[0-9]{3,}/evidence/NODE-[0-9]{3,}/$"
            },
            "seal": {
              "type": "object",
              "description": "DEM-020: HMAC seal over the canonical contract bytes (validation.required + traced requirements' acceptance) at the moment a human approved the node. A mismatch means the contract was edited after sealing.",
              "required": ["digest", "algo"],
              "additionalProperties": false,
              "properties": {
                "digest": { "type": "string", "minLength": 1 },
                "algo": { "type": "string", "enum": ["sha256-hmac"] },
                "sealed_at": { "type": "string" },
                "sealed_by": { "type": "string" }
              }
            },
            "holdout_digest": {
              "type": "string",
              "description": "DEM-020 Track 3: HMAC digest pointer to the node's sealed holdout criteria in delivery-graph/holdout/NODE-###.json. The criteria TEXT never appears in graph.json — only this pointer — so a builder cannot overfit to criteria it never saw.",
              "minLength": 1
            }
          }
        },
        "sync": {
          "type": "object",
          "description": "Per-tracker projection ids. Open by design: an adapter owns its own key (e.g. linear_issue_id, ado_task_id, github_issue_number) so a new tracker does not require a core-schema change. The canonical graph stays the source of truth; these are just back-references into projections.",
          "properties": {
            "linear_issue_id": { "type": ["string", "null"] },
            "ado_task_id": { "type": ["string", "number", "null"] }
          }
        },
        "waiver": {
          "type": "object",
          "description": "Present only on a done-waived node. Records why the evidence gate was waived for un-provable work, keeping every skip signed and auditable.",
          "required": ["reason", "waived_at"],
          "additionalProperties": false,
          "properties": {
            "reason": { "type": "string", "minLength": 1 },
            "waived_at": { "type": "string" }
          }
        }
      }
    }
  }
}

